{"aggregationPolicy":{"obligationEligibleBases":[],"rule":"PRESERVE_UPSTREAM_OVERALL","unknownHandling":"INCONCLUSIVE_WHEN_REQUIRED_PREDICATE_UNDETERMINED"},"allowedBases":["MODEL_JUDGMENT"],"description":"Preserves a project-authored synthetic upstream-style assessment as MODEL_JUDGMENT without upgrading it to factual truth. The fixture demonstrates the normalization boundary and makes no claim about an external provider.","evaluationClass":"UPSTREAM_NORMALIZATION","mappingPolicy":{"description":"Map synthetic supported booleans to AFFIRMED or REJECTED MODEL_JUDGMENT assessments; force every predicateStatus to UNDETERMINED; preserve the aggregate result; never map payout fields to a recommendation or action.","policyId":"synthetic-model-judgment-mapping-v0"},"operation":"NORMALIZE","predicates":[{"basis":"MODEL_JUDGMENT","description":"Preserve the synthetic source's supported boolean as a typed assessment, not as an established predicate.","predicateId":"source-claim-assessment"}],"profileId":"synthetic-model-judgment-normalization-v0","proof":{"jws":"eyJhbGciOiJFZERTQSIsImtpZCI6IkRNeFA3TlVRak5TTUQ2VndFQ0dMenVLVzVBVXQ2ZXN5VWVsWk9ZTjgtWnciLCJ0eXAiOiJldmFsZG9zc2llci5wcm9maWxlLWRlZmluaXRpb24vMC4xIn0..Y8u_N09L6yTB5KAnN9j_83r2_x2-jirgVSQ2KAJmBhs6gxn2VGYmKpi0hbsdo8RRyoy_CcLJcKS5U825zoS_Ag","type":"evaldossier.detached-jws/0.1"},"protocolVersion":"evaldossier/0.1","publishedAt":"2026-07-21T12:05:00Z","publisher":{"id":"evaldossier-model-judgment-fixture-adapter","key":{"alg":"EdDSA","crv":"Ed25519","kid":"DMxP7NUQjNSMD6VwECGLzuKW5AUt6esyUelZOYN8-Zw","kty":"OKP","use":"sig","x":"zu0OShi6bccH4hfzGD1IP88htWPCpTm-ZntpLpMYSlc"}},"resultBindingMode":"PRESERVE_UPSTREAM_ASSESSMENT","schemaVersion":"evaldossier.profile-definition/0.1","signatureContext":{"audience":"evaldossier-offline-demo","nonce":"model-judgment-profile-nonce-0001"},"signingKeyId":"DMxP7NUQjNSMD6VwECGLzuKW5AUt6esyUelZOYN8-Zw","title":"Synthetic no-evidence model-judgment normalization","version":"0.1.0"}