{"aggregationPolicy":{"obligationEligibleBases":["FORMAL_PREDICATE"],"rule":"ALL_REQUIRED_TRUE","unknownHandling":"INCONCLUSIVE_WHEN_REQUIRED_PREDICATE_UNDETERMINED"},"allowedBases":["FORMAL_PREDICATE"],"description":"Establishes presence, raw-byte SHA-256 equality, and conformance of committed JSON bytes to a committed local-only JSON Schema. It does not establish broader commercial intent.","evaluationClass":"DETERMINISTIC","mappingPolicy":{"description":"Direct deterministic evaluation; no upstream result is normalized or strengthened.","policyId":"direct-formal-predicate-v0"},"operation":"EVALUATE","predicates":[{"basis":"FORMAL_PREDICATE","description":"The committed deliverable artifact is present and non-empty.","predicateId":"artifact-present"},{"basis":"FORMAL_PREDICATE","description":"The deliverable's raw-byte SHA-256 digest and size match the request commitment.","predicateId":"artifact-digest-matches"},{"basis":"FORMAL_PREDICATE","description":"The committed deliverable is strict JSON valid against the committed local-only JSON Schema.","predicateId":"local-json-schema-valid"}],"profileId":"json-artifact-conformance-v0","proof":{"jws":"eyJhbGciOiJFZERTQSIsImtpZCI6Ims2aXpUQ2ctVlV3bjNoYjZHZDVQaks3Ykd6clpJWWoyd3JTWGJmd3otaTQiLCJ0eXAiOiJldmFsZG9zc2llci5wcm9maWxlLWRlZmluaXRpb24vMC4xIn0..Yuuc97KRHjR2YTQxmGknvZT2P-s_fEc2ffsjx_6V_IOuB8P22DMuaf2QMDx8MdkZ8vEILNAsBspY8pL5mTRdAQ","type":"evaldossier.detached-jws/0.1"},"protocolVersion":"evaldossier/0.1","publishedAt":"2026-07-21T12:00:00Z","publisher":{"id":"evaldossier-reference-evaluator","key":{"alg":"EdDSA","crv":"Ed25519","kid":"k6izTCg-VUwn3hb6Gd5PjK7bGzrZIYj2wrSXbfwz-i4","kty":"OKP","use":"sig","x":"R558iM3wPW34I3VnVUXLszWAyUmDzoTcqLMM-Wez7LU"}},"resultBindingMode":"DIRECT_PREDICATE_RESULT","schemaVersion":"evaldossier.profile-definition/0.1","signatureContext":{"audience":"evaldossier-offline-demo","nonce":"reference-profile-nonce-0001"},"signingKeyId":"k6izTCg-VUwn3hb6Gd5PjK7bGzrZIYj2wrSXbfwz-i4","title":"Local JSON artifact conformance","version":"0.1.0"}